{
  "$schema": "http://json-schema.org/draft-07/schema#",
  "title": "Exames de Tomografia (Granularizado)",
  "type": "array",
  "items": {
    "type": "object",
    "properties": {
      "modalidade": {
        "type": "string"
      },
      "exame": {
        "type": "string"
      },
      "codigo": {
        "type": "string"
      },
      "preparo": {
        "oneOf": [
          {
            "type": "null"
          },
          {
            "type": "array",
            "items": {
              "type": "string"
            }
          },
          {
            "type": "null"
          },
          {
            "type": "null"
          },
          {
            "type": "array",
            "items": {
              "type": "string"
            }
          },
          {
            "type": "null"
          },
          {
            "type": "array",
            "items": {
              "type": "string"
            }
          },
          {
            "type": "array",
            "items": {
              "type": "string"
            }
          },
          {
            "type": "null"
          },
          {
            "type": "null"
          },
          {
            "type": "null"
          },
          {
            "type": "null"
          },
          {
            "type": "array",
            "items": {
              "type": "string"
            }
          },
          {
            "type": "array",
            "items": {
              "type": "string"
            }
          },
          {
            "type": "null"
          },
          {
            "type": "array",
            "items": {
              "type": "string"
            }
          },
          {
            "type": "array",
            "items": {
              "type": "string"
            }
          },
          {
            "type": "array",
            "items": {
              "type": "string"
            }
          },
          {
            "type": "array",
            "items": {
              "type": "string"
            }
          },
          {
            "type": "array",
            "items": {
              "type": "string"
            }
          },
          {
            "type": "null"
          },
          {
            "type": "array",
            "items": {
              "type": "string"
            }
          },
          {
            "type": "array",
            "items": {
              "type": "string"
            }
          },
          {
            "type": "array",
            "items": {
              "type": "string"
            }
          },
          {
            "type": "array",
            "items": {
              "type": "string"
            }
          },
          {
            "type": "array",
            "items": {
              "type": "string"
            }
          },
          {
            "type": "array",
            "items": {
              "type": "string"
            }
          },
          {
            "type": "array",
            "items": {
              "type": "string"
            }
          },
          {
            "type": "array",
            "items": {
              "type": "string"
            }
          }
        ]
      },
      "descricao": {
        "type": "string"
      },
      "medicos_envolvidos": {
        "type": "array",
        "items": {
          "type": "null"
        }
      },
      "sinonimos": {
        "type": "array",
        "items": {
          "type": "string"
        }
      }
    },
    "required": [
      "modalidade",
      "exame",
      "codigo",
      "descricao",
      "medicos_envolvidos",
      "sinonimos"
    ]
  },
  "additionalItems": false
}