[
  {
    "exame": "Angio-TC aorta abdominal",
    "codigo": "35111248",
    "modalidade": "TC",
    "preparo": [
      "Jejum de 4 horas",
      "Avisar se for alérgico a iodo",
      "Levar exames anteriores"
    ],
    "descricao": "Angiotomografia da aorta abdominal",
    "medicos_envolvidos": [],
    "sinonimos": [
      "angio tc aorta",
      "angio tc abdominal",
      "angiotomografia aorta abdominal"
    ]
  },
  {
    "exame": "Angio-TC crânio",
    "codigo": "35111255",
    "modalidade": "TC",
    "preparo": [
      "Jejum de 4 horas",
      "Avisar se for alérgico a iodo",
      "Levar exames anteriores"
    ],
    "descricao": "Angiotomografia do crânio",
    "medicos_envolvidos": [],
    "sinonimos": [
      "angio tc cranio",
      "angiotomografia craniana",
      "angio tc cabeça"
    ]
  },
  {
    "exame": "Angio-TC coronárias",
    "codigo": "35111263",
    "modalidade": "TC",
    "preparo": [
      "Jejum de 6 horas",
      "Trazer exames anteriores",
      "Evitar cafeína no dia do exame"
    ],
    "descricao": "Angiotomografia de coronárias",
    "medicos_envolvidos": [],
    "sinonimos": [
      "angio tc coronaria",
      "angiotomografia coronariana",
      "angio coronária"
    ]
  }
]
